{
  "id": "tumor_type_baselines.breast_first_line",
  "kind": "context_baseline",
  "purpose": "growth",
  "subsystem": "tumor_type_baselines",
  "name": "breast first-line baseline tumor size and growth",
  "description": "Context-baseline record: typical baseline RECIST sum-of-longest-diameters and unperturbed growth-rate constant for first-line metastatic breast cancer. Supplies y0 and a reference growth rate for the virtual-trial divergence view. Values illustrative and unverified.",
  "structure": {
    "states": [
      "tumor_size"
    ]
  },
  "parameters": [
    {
      "symbol": "baseline_tumor_size",
      "label": "baseline SLD",
      "value": {
        "central": 69.0,
        "low": 25.0,
        "high": 110.0,
        "units": "mm"
      },
      "iiv_cv_percent": 55,
      "tier": "C",
      "primary_citation": "krishnan-2021-breast-tgi",
      "extraction": {
        "review_status": "pending_human_review",
        "source_locator": "Krishnan 2021 (PMID 33818899, PMC8129720) median summed SLD = 69 mm; AVADO docetaxel arm, HER2-negative 1L mBC, n=183; open access; human PDF sign-off pending",
        "tier_rationale": "Population baseline varies widely by stage and enrollment."
      }
    },
    {
      "symbol": "kg",
      "label": "unperturbed growth rate constant",
      "value": {
        "central": 0.00917,
        "low": null,
        "high": null,
        "units": "1/week"
      },
      "iiv_cv_percent": 135,
      "tier": "C",
      "primary_citation": "krishnan-2021-breast-tgi",
      "extraction": {
        "review_status": "pending_human_review",
        "source_locator": "Krishnan 2021 (PMID 33818899) kGROW for liver/breast lesions = 0.00917/week, IIV CV 135%; open access; human PDF sign-off pending",
        "tier_rationale": "Indication-level central estimate."
      }
    }
  ],
  "derivation_context": {
    "drug": null,
    "drug_class": null,
    "tumor_type": "breast",
    "line_of_therapy": "first",
    "trial": "illustrative",
    "n_patients": null,
    "measurement": "RECIST_sum_longest_diameters"
  },
  "transportability": {
    "validated_tumor_types": [
      "breast"
    ],
    "validated_drug_classes": [],
    "validated_lines": [
      "first"
    ],
    "out_of_context_action": "tier_down_to_D and warn"
  },
  "tier": "C",
  "review_status": "pending_human_review",
  "primary_citation": "krishnan-2021-breast-tgi"
}
