{
  "id": "survival_link.nsclc_os_growth_rate",
  "kind": "model",
  "purpose": "survival_link",
  "subsystem": "survival_link",
  "name": "NSCLC OS link from the tumor growth-rate constant k_g (Weibull PH)",
  "description": "Parametric proportional-hazards link from a TGI metric to population overall survival, driven by the tumor GROWTH-RATE CONSTANT k_g (the post-nadir regrowth rate) rather than the early week-8 change. S(t) = exp(-(t/scale)^shape * exp(beta * k_g)); a faster-regrowing tumor (larger k_g) raises the hazard. The Stein/Bruno literature finds k_g a stronger, more durable OS predictor than early shrinkage because it captures the regrowth tail. This is the NON-DEFAULT, tail-sensitive alternative to the week-8 link (structure.default=false), reached via the explicit survival_link= argument, making 'which on-treatment metric predicts survival' an explicit model-selection axis. A model with no regrowth (k_g undefined) maps to the baseline hazard. Population/trial-level only; values illustrative and unverified.",
  "kernel": "survival_weibull_ph",
  "structure": {
    "growth_law": null,
    "survival_baseline": "weibull",
    "endpoint": "OS",
    "default": false,
    "link_metric": "tumor_growth_rate_kg",
    "states": [
      "survival_fraction"
    ]
  },
  "parameters": [
    {
      "symbol": "weibull_shape",
      "label": "Weibull shape (k)",
      "value": { "central": 1.3, "low": null, "high": null, "units": "dimensionless" },
      "iiv_cv_percent": null,
      "tier": "B",
      "primary_citation": "stein-2008-grc",
      "extraction": { "review_status": "unverified", "source_locator": "model form; value illustrative", "tier_rationale": "Baseline-hazard shape from registrational pooling." }
    },
    {
      "symbol": "weibull_scale",
      "label": "Weibull scale (median-OS scale at k_g = 0)",
      "value": { "central": 135.0, "low": null, "high": null, "units": "week" },
      "iiv_cv_percent": null,
      "tier": "B",
      "primary_citation": "stein-2008-grc",
      "extraction": { "review_status": "unverified", "source_locator": "model form; value illustrative", "tier_rationale": "Sets baseline median OS for a non-regrowing (k_g=0) NSCLC tumor." }
    },
    {
      "symbol": "beta",
      "label": "log-hazard coefficient on the growth-rate constant k_g",
      "value": { "central": 60.0, "low": null, "high": null, "units": "per (1/week)" },
      "iiv_cv_percent": null,
      "tier": "C",
      "primary_citation": "stein-2008-grc",
      "extraction": { "review_status": "unverified", "source_locator": "model form; value illustrative", "tier_rationale": "k_g is small (~0.02/wk), so its per-unit hazard coefficient is large; link strength varies across trials." }
    }
  ],
  "derivation_context": {
    "drug": null,
    "drug_class": null,
    "tumor_type": "NSCLC",
    "line_of_therapy": "first",
    "trial": "illustrative",
    "n_patients": 1000,
    "measurement": "RECIST_sum_longest_diameters"
  },
  "transportability": {
    "validated_tumor_types": ["NSCLC"],
    "validated_drug_classes": [],
    "validated_lines": ["first"],
    "out_of_context_action": "tier_down_to_D and warn"
  },
  "predictive_performance": [
    { "metric": "OS_C_index_external", "value": 0.69, "population": "independent NSCLC cohort (illustrative; k_g typically out-discriminates early shrinkage)", "citation": "stein-2008-grc" }
  ],
  "tier": "C",
  "review_status": "unverified",
  "primary_citation": "stein-2008-grc"
}
