{
  "id": "resistance.nsclc_first_line.acquired",
  "kind": "model",
  "purpose": "tgi",
  "subsystem": "resistance",
  "name": "Acquired (drug-induced) resistance model — NSCLC first line",
  "description": "Mechanistic resistance whose ORIGIN is acquired, not pre-existing: a drug-sensitive clone S and a resistant clone R observed together as tumor size V = S + R, but the resistant clone is GENERATED during treatment — under drug pressure E, sensitive cells convert to resistant at switching rate alpha (dS/dt = (kg - kd*E)*S - alpha*E*S; dR/dt = kgr*R + alpha*E*S), starting from R0 = 0 (no resistance pre-exists). The kg/kd/kgr are matched to the pre-existing two-population model so the contrast isolates the resistance ORIGIN — acquired switching vs a pre-existing resistant subclone — a model-selection axis one layer below the phenomenological-vs-mechanistic choice. Parameter values are illustrative (NSCLC first-line scale) and unverified; the switching rate alpha is biologically interpretable (Goldie-Coldman acquired-mutation kinetics) but, like the pre-existing R0, poorly identified from a short trial. NOTE: the open-access mechanistic basis (Bozic 2013, eLife e00747, PMID 23805382) gives the acquired-resistance rate as a per-division point-mutation rate (u~1e-9), which does not transcribe into this phenomenological per-week switching rate; values stay illustrative. See docs/verification/workhorse-models.md.",
  "kernel": "acquired_resistance",
  "structure": {
    "growth_law": "exponential",
    "kill_model": "first_order_sensitive_clone_only",
    "resistance": "acquired_drug_induced_switching",
    "states": [
      "sensitive",
      "resistant"
    ]
  },
  "parameters": [
    {
      "symbol": "kg",
      "label": "sensitive-clone growth rate constant",
      "value": {
        "central": 0.021,
        "low": null,
        "high": null,
        "units": "1/week"
      },
      "iiv_cv_percent": 38,
      "tier": "B",
      "primary_citation": "foo-michor-2014",
      "extraction": {
        "review_status": "unverified",
        "source_locator": "model form (Foo-Michor 2014 acquired-resistance evolution); value illustrative (matched to two-population kg)",
        "tier_rationale": "Established two-clone model form; growth rate is indication-specific."
      }
    },
    {
      "symbol": "kd",
      "label": "drug-induced kill potency on the sensitive clone",
      "value": {
        "central": 0.3,
        "low": null,
        "high": null,
        "units": "1/week per effect-unit"
      },
      "iiv_cv_percent": 89,
      "tier": "C",
      "primary_citation": "foo-michor-2014",
      "extraction": {
        "review_status": "unverified",
        "source_locator": "model form; value illustrative (matched to two-population kd)",
        "tier_rationale": "Kill potency poorly identified from short trials; high IIV CV."
      }
    },
    {
      "symbol": "kg_resistant",
      "label": "resistant-clone growth rate constant",
      "value": {
        "central": 0.025,
        "low": null,
        "high": null,
        "units": "1/week"
      },
      "iiv_cv_percent": 55,
      "tier": "C",
      "primary_citation": "foo-michor-2014",
      "extraction": {
        "review_status": "unverified",
        "source_locator": "model form; value illustrative (matched to two-population kgr)",
        "tier_rationale": "Resistant-clone kinetics rarely measured directly; single-context value."
      }
    },
    {
      "symbol": "alpha",
      "label": "acquired-resistance switching rate (sensitive → resistant per effect-unit)",
      "value": {
        "central": 0.02,
        "low": null,
        "high": null,
        "units": "1/week per effect-unit"
      },
      "iiv_cv_percent": 110,
      "tier": "C",
      "primary_citation": "foo-michor-2014",
      "extraction": {
        "review_status": "unverified",
        "source_locator": "model form (acquired-mutation rate); value illustrative",
        "tier_rationale": "The drug-induced switching rate is the acquired-resistance analog of the pre-existing burden — biologically interpretable but practically unidentifiable from a short trial; ~100%+ CV expected."
      }
    },
    {
      "symbol": "R0",
      "label": "initial resistant-clone burden (zero — resistance is acquired, not pre-existing)",
      "value": {
        "central": 0.0,
        "low": null,
        "high": null,
        "units": "mm (SLD-equivalent)"
      },
      "iiv_cv_percent": null,
      "tier": "C",
      "primary_citation": "goldie-coldman-1979",
      "extraction": {
        "review_status": "unverified",
        "source_locator": "model assumption: no pre-existing resistance (R0 = 0); the resistant pool is generated by switching",
        "tier_rationale": "Fixed at zero by the acquired-resistance assumption (the contrast against the pre-existing two-population R0)."
      }
    }
  ],
  "derivation_context": {
    "drug": "illustrative_cytotoxic",
    "drug_class": "generic_kill_with_acquired_resistance",
    "tumor_type": "NSCLC",
    "line_of_therapy": "first",
    "trial": "illustrative",
    "n_patients": null,
    "measurement": "RECIST_sum_longest_diameters"
  },
  "transportability": {
    "validated_tumor_types": [
      "NSCLC"
    ],
    "validated_drug_classes": [
      "generic_kill_with_acquired_resistance"
    ],
    "validated_lines": [
      "first"
    ],
    "out_of_context_action": "tier_down_to_D and warn"
  },
  "known_failure_modes": [
    {
      "condition": "applied to a regimen whose resistance is pre-existing rather than treatment-acquired",
      "behavior": "alpha unidentifiable; the acquired regrowth tail is fabricated rather than fit",
      "action": "tier_down_to_D and warn",
      "citation": "bruno-2020-review"
    }
  ],
  "predictive_performance": [
    {
      "metric": "OS_C_index_external",
      "value": 0.6,
      "population": "independent NSCLC cohort (illustrative)",
      "citation": "foo-michor-2014"
    }
  ],
  "tier": "C",
  "review_status": "unverified",
  "primary_citation": "foo-michor-2014"
}
