{
  "id": "survival_link.melanoma_os_growth_rate",
  "kind": "model",
  "purpose": "survival_link",
  "subsystem": "survival_link",
  "name": "melanoma OS link from the tumor growth-rate constant k_g (Weibull PH)",
  "description": "Parametric proportional-hazards link to OS driven by the tumor GROWTH-RATE CONSTANT k_g (post-nadir regrowth) rather than the early week-8 change. S(t) = exp(-(t/scale)^shape * exp(beta * k_g)); a faster-regrowing tumor raises the hazard. Non-default, tail-sensitive alternative to the melanoma week-8 link (structure.default=false), reached via survival_link=. A model with no regrowth (k_g undefined) maps to the baseline hazard. Population/trial-level only; values illustrative and unverified.",
  "kernel": "survival_weibull_ph",
  "structure": {
    "growth_law": null,
    "survival_baseline": "weibull",
    "endpoint": "OS",
    "default": false,
    "link_metric": "tumor_growth_rate_kg",
    "states": [
      "survival_fraction"
    ]
  },
  "parameters": [
    {
      "symbol": "weibull_shape",
      "label": "weibull_shape",
      "value": {
        "central": 1.3,
        "low": null,
        "high": null,
        "units": "dimensionless"
      },
      "iiv_cv_percent": null,
      "tier": "B",
      "primary_citation": "stein-2008-grc",
      "extraction": {
        "review_status": "unverified",
        "source_locator": "model form; value illustrative",
        "tier_rationale": "Baseline-hazard shape from registrational pooling."
      }
    },
    {
      "symbol": "weibull_scale",
      "label": "weibull_scale",
      "value": {
        "central": 170.0,
        "low": null,
        "high": null,
        "units": "week"
      },
      "iiv_cv_percent": null,
      "tier": "B",
      "primary_citation": "stein-2008-grc",
      "extraction": {
        "review_status": "unverified",
        "source_locator": "model form; value illustrative",
        "tier_rationale": "Sets baseline median OS for a non-regrowing (k_g=0) melanoma tumor."
      }
    },
    {
      "symbol": "beta",
      "label": "beta",
      "value": {
        "central": 45.0,
        "low": null,
        "high": null,
        "units": "per (1/week)"
      },
      "iiv_cv_percent": null,
      "tier": "C",
      "primary_citation": "stein-2008-grc",
      "extraction": {
        "review_status": "unverified",
        "source_locator": "model form; value illustrative",
        "tier_rationale": "k_g is small, so its per-unit hazard coefficient is large; link strength varies across trials."
      }
    }
  ],
  "derivation_context": {
    "drug": null,
    "drug_class": null,
    "tumor_type": "melanoma",
    "line_of_therapy": "first",
    "trial": "illustrative",
    "n_patients": 1000,
    "measurement": "RECIST_sum_longest_diameters"
  },
  "transportability": {
    "validated_tumor_types": [
      "melanoma"
    ],
    "validated_drug_classes": [],
    "validated_lines": [
      "first"
    ],
    "out_of_context_action": "tier_down_to_D and warn"
  },
  "predictive_performance": [
    {
      "metric": "OS_C_index_external",
      "value": 0.69,
      "population": "independent melanoma cohort (illustrative; k_g typically out-discriminates early shrinkage)",
      "citation": "stein-2008-grc"
    }
  ],
  "tier": "C",
  "review_status": "unverified",
  "primary_citation": "stein-2008-grc"
}
