{
  "id": "preclinical_translation.ovarian_xenograft_baseline",
  "kind": "context_baseline",
  "purpose": "growth",
  "subsystem": "preclinical_translation",
  "name": "Ovarian xenograft (A2780) baseline tumor weight and growth",
  "description": "Context-baseline record for a mouse ovarian-carcinoma xenograft: baseline implanted tumor weight and first-order growth rate. Supplies the initial tumor weight w0 for the Simeoni preclinical model. Values illustrative and unverified.",
  "structure": { "states": ["tumor_size"] },
  "parameters": [
    {
      "symbol": "baseline_tumor_size",
      "label": "baseline tumor weight (w0)",
      "value": { "central": 0.05, "low": 0.02, "high": 0.10, "units": "g" },
      "iiv_cv_percent": 35,
      "tier": "C",
      "primary_citation": "simeoni-2004-xenograft",
      "extraction": { "review_status": "unverified", "source_locator": "implantation protocol; value illustrative", "tier_rationale": "Depends on implantation and randomization day." }
    },
    {
      "symbol": "lambda0",
      "label": "first-order growth rate",
      "value": { "central": 0.20, "low": null, "high": null, "units": "1/day" },
      "iiv_cv_percent": 30,
      "tier": "C",
      "primary_citation": "simeoni-2004-xenograft",
      "extraction": { "review_status": "unverified", "source_locator": "cell-line growth; value illustrative", "tier_rationale": "Cell-line specific." }
    }
  ],
  "derivation_context": {
    "drug": null,
    "drug_class": null,
    "tumor_type": "ovarian_xenograft",
    "line_of_therapy": null,
    "trial": "mouse xenograft (A2780, illustrative)",
    "n_patients": 40,
    "measurement": "tumor_weight_g"
  },
  "transportability": {
    "validated_tumor_types": ["ovarian_xenograft"],
    "validated_drug_classes": [],
    "out_of_context_action": "tier_down_to_D and warn"
  },
  "tier": "C",
  "review_status": "unverified",
  "primary_citation": "simeoni-2004-xenograft"
}
