{
  "id": "growth_laws.von_bertalanffy",
  "kind": "model",
  "purpose": "growth",
  "subsystem": "growth_laws",
  "name": "Von Bertalanffy (surface-area-limited) unperturbed tumor growth",
  "description": "Unperturbed tumor growth law dV/dt = a*V^(2/3) - b*V. Proliferation scales with the tumor SURFACE (V^(2/3): nutrient and oxygen access at the rim) while loss scales with VOLUME (V), the classic von Bertalanffy / ontogenetic growth model. Growth is sub-exponential from the start (the specific growth rate falls monotonically with size) and approaches a carrying capacity V_inf = (a/b)^3, where dV/dt = 0. Completes the spec §2 growth-law family (exponential / logistic / Gompertz / Simeoni / von Bertalanffy-power-law). Illustrative values; review_status unverified.",
  "kernel": "growth_von_bertalanffy",
  "structure": {
    "growth_law": "von_bertalanffy",
    "kill_model": null,
    "resistance": null,
    "states": ["tumor_size"]
  },
  "parameters": [
    {
      "symbol": "a",
      "label": "surface-proliferation coefficient",
      "value": { "central": 0.2924, "low": null, "high": null, "units": "mm^(1/3) per week" },
      "iiv_cv_percent": null,
      "tier": "B",
      "primary_citation": "bruno-2020-review",
      "extraction": { "review_status": "unverified", "source_locator": "general form", "tier_rationale": "Established structural form; illustrative value (set with b so V_inf=(a/b)^3=200)." }
    },
    {
      "symbol": "b",
      "label": "volume-loss coefficient",
      "value": { "central": 0.05, "low": null, "high": null, "units": "1/week" },
      "iiv_cv_percent": null,
      "tier": "B",
      "primary_citation": "bruno-2020-review",
      "extraction": { "review_status": "unverified", "source_locator": "general form", "tier_rationale": "Established structural form; illustrative value." }
    }
  ],
  "transportability": {
    "validated_tumor_types": [],
    "validated_drug_classes": [],
    "out_of_context_action": "warn"
  },
  "tier": "B",
  "review_status": "unverified",
  "primary_citation": "bruno-2020-review"
}
