{
  "id": "survival_link.hcc_os_burden_auc",
  "kind": "model",
  "purpose": "survival_link",
  "subsystem": "survival_link",
  "name": "HCC OS link from the integrated tumor burden (log-burden AUC, Weibull PH)",
  "description": "Parametric proportional-hazards link from a TGI metric to population overall survival, driven by the INTEGRATED TUMOR BURDEN — the time-averaged log relative tumor size over the observation horizon (the AUC of the log-size curve; the log geometric-mean relative burden). S(t) = exp(-(t/scale)^shape * exp(beta * b)), b = mean_t log(v(t)/y0); a tumor that spends more time large (shallow nadir AND/OR a heavy regrowth tail) carries more burden and raises the hazard. Unlike the week-8 link (one early point, blind to the tail) and unlike the k_g link (the terminal regrowth slope, blind to depth), this single covariate integrates BOTH depth of response and regrowth, so it re-ranks models a third way. NON-DEFAULT (structure.default=false), reached via the explicit survival_link= argument, making 'which on-treatment metric predicts survival' an explicit model-selection axis. The covariate is horizon-dependent by construction (it is a cumulative-burden summary); a complete responder's burden is floored at the detection limit, not -inf. Cross-context sibling of survival_link.nsclc_os_burden_auc (same shape and burden coefficient; the scale is set to the HCC OS scale), added so the three-bridge-metric comparison is dataset-wide rather than NSCLC-only. Population/trial-level only; values illustrative and unverified.",
  "kernel": "survival_weibull_ph",
  "structure": {
    "growth_law": null,
    "survival_baseline": "weibull",
    "endpoint": "OS",
    "default": false,
    "link_metric": "log_burden_auc",
    "states": [
      "survival_fraction"
    ]
  },
  "parameters": [
    {
      "symbol": "weibull_shape",
      "label": "Weibull shape (k)",
      "value": {
        "central": 1.3,
        "low": null,
        "high": null,
        "units": "dimensionless"
      },
      "iiv_cv_percent": null,
      "tier": "B",
      "primary_citation": "wang-2009-tgi",
      "extraction": {
        "review_status": "unverified",
        "source_locator": "model form; value illustrative",
        "tier_rationale": "Baseline-hazard shape from registrational pooling."
      }
    },
    {
      "symbol": "weibull_scale",
      "label": "Weibull scale (median-OS scale at zero net burden)",
      "value": {
        "central": 65.0,
        "low": null,
        "high": null,
        "units": "week"
      },
      "iiv_cv_percent": null,
      "tier": "B",
      "primary_citation": "wang-2009-tgi",
      "extraction": {
        "review_status": "unverified",
        "source_locator": "model form; value illustrative",
        "tier_rationale": "Sets baseline median OS for a tumor held at baseline size (zero integrated burden)."
      }
    },
    {
      "symbol": "beta",
      "label": "log-hazard coefficient on the integrated log-burden",
      "value": {
        "central": 0.2,
        "low": null,
        "high": null,
        "units": "per log-relative-burden-unit"
      },
      "iiv_cv_percent": null,
      "tier": "C",
      "primary_citation": "wang-2009-tgi",
      "extraction": {
        "review_status": "unverified",
        "source_locator": "model form; value illustrative",
        "tier_rationale": "The integrated burden spans several log units across models; link strength varies across trials."
      }
    }
  ],
  "derivation_context": {
    "drug": null,
    "drug_class": null,
    "tumor_type": "HCC",
    "line_of_therapy": "first",
    "trial": "illustrative",
    "n_patients": 1000,
    "measurement": "RECIST_sum_longest_diameters"
  },
  "transportability": {
    "validated_tumor_types": [
      "HCC"
    ],
    "validated_drug_classes": [],
    "validated_lines": [
      "first"
    ],
    "out_of_context_action": "tier_down_to_D and warn"
  },
  "predictive_performance": [
    {
      "metric": "OS_C_index_external",
      "value": 0.67,
      "population": "independent HCC cohort (illustrative; an integrated-burden metric tends to sit between early-shrinkage and k_g on discrimination)",
      "citation": "wang-2009-tgi"
    }
  ],
  "tier": "C",
  "review_status": "unverified",
  "primary_citation": "wang-2009-tgi"
}
